{
  "id": "agent.local.ocr",
  "name": "本地OCR识别",
  "version": "0.1.0",
  "description": "从选中的屏幕区域提取文字，无需云端上传。",
  "capabilities": ["extract_text"],
  "input_types": ["screen_region", "image_region"],
  "output_types": ["ocr_text", "plain_text"],
  "execution_mode": "local",
  "latency_level": "short",
  "cost_level": "none",
  "required_permissions": ["screen_region_read"],
  "privacy_policy": {
    "requires_upload": false,
    "sensitive_data_allowed": true,
    "user_confirmation": "never"
  }
}
